{
  "modo": "exemplo",
  "gerado_em": "2026-07-17",
  "escopo": "conta act_EXEMPLO (Academia Fit — dados fictícios para demonstração)",
  "granularidade_pedida": "todas",
  "series": {
    "dia": [
      {
        "periodo": "2026-06-18",
        "granularidade": "dia",
        "spend": 30,
        "impressions": 5556,
        "clicks": 106,
        "inline_link_clicks": 91,
        "ctr": 1.9,
        "cpm": 5.4,
        "cpc": 0.28,
        "frequency": 1.3,
        "reach": 4274,
        "purchases": 2,
        "roas": {
          "valor": 1.6,
          "selo": "Estimado"
        },
        "selo": "Real",
        "fonte": "dados de exemplo (fixture) — Academia Fit, fictício"
      },
      {
        "periodo": "2026-06-19",
        "granularidade": "dia",
        "spend": 35.16,
        "impressions": 6031,
        "clicks": 114,
        "inline_link_clicks": 98,
        "ctr": 1.89,
        "cpm": 5.83,
        "cpc": 0.31,
        "frequency": 1.36,
        "reach": 4435,
        "purchases": 3,
        "roas": {
          "valor": 1.77,
          "selo": "Estimado"
        },
        "selo": "Real",
        "fonte": "dados de exemplo (fixture) — Academia Fit, fictício"
      },
      {
        "periodo": "2026-06-20",
        "granularidade": "dia",
        "spend": 40.11,
        "impressions": 6753,
        "clicks": 120,
        "inline_link_clicks": 103,
        "ctr": 1.77,
        "cpm": 5.94,
        "cpc": 0.33,
        "frequency": 1.42,
        "reach": 4756,
        "purchases": 3,
        "roas": {
          "valor": 1.78,
          "selo": "Estimado"
        },
        "selo": "Real",
        "fonte": "dados de exemplo (fixture) — Academia Fit, fictício"
      },
      {
        "periodo": "2026-06-21",
        "granularidade": "dia",
        "spend": 44.65,
        "impressions": 7792,
        "clicks": 130,
        "inline_link_clicks": 112,
        "ctr": 1.67,
        "cpm": 5.73,
        "cpc": 0.34,
        "frequency": 1.48,
        "reach": 5265,
        "purchases": 3,
        "roas": {
          "valor": 1.63,
          "selo": "Estimado"
        },
        "selo": "Real",
        "fonte": "dados de exemplo (fixture) — Academia Fit, fictício"
      },
      {
        "periodo": "2026-06-22",
        "granularidade": "dia",
        "spend": 48.63,
        "impressions": 8907,
        "clicks": 150,
        "inline_link_clicks": 129,
        "ctr": 1.68,
        "cpm": 5.46,
        "cpc": 0.32,
        "frequency": 1.54,
        "reach": 5784,
        "purchases": 3,
        "roas": {
          "valor": 1.45,
          "selo": "Estimado"
        },
        "selo": "Real",
        "fonte": "dados de exemplo (fixture) — Academia Fit, fictício"
      },
      {
        "periodo": "2026-06-23",
        "granularidade": "dia",
        "spend": 51.97,
        "impressions": 9501,
        "clicks": 156,
        "inline_link_clicks": 134,
        "ctr": 1.64,
        "cpm": 5.47,
        "cpc": 0.33,
        "frequency": 1.6,
        "reach": 5938,
        "purchases": 3,
        "roas": {
          "valor": 1.41,
          "selo": "Estimado"
        },
        "selo": "Real",
        "fonte": "dados de exemplo (fixture) — Academia Fit, fictício"
      },
      {
        "periodo": "2026-06-24",
        "granularidade": "dia",
        "spend": 54.66,
        "impressions": 9376,
        "clicks": 142,
        "inline_link_clicks": 122,
        "ctr": 1.51,
        "cpm": 5.83,
        "cpc": 0.38,
        "frequency": 1.66,
        "reach": 5648,
        "purchases": 3,
        "roas": {
          "valor": 1.54,
          "selo": "Estimado"
        },
        "selo": "Real",
        "fonte": "dados de exemplo (fixture) — Academia Fit, fictício"
      },
      {
        "periodo": "2026-06-25",
        "granularidade": "dia",
        "spend": 56.74,
        "impressions": 9021,
        "clicks": 131,
        "inline_link_clicks": 113,
        "ctr": 1.45,
        "cpm": 6.29,
        "cpc": 0.43,
        "frequency": 1.72,
        "reach": 5245,
        "purchases": 3,
        "roas": {
          "valor": 1.73,
          "selo": "Estimado"
        },
        "selo": "Real",
        "fonte": "dados de exemplo (fixture) — Academia Fit, fictício"
      },
      {
        "periodo": "2026-06-26",
        "granularidade": "dia",
        "spend": 58.34,
        "impressions": 8948,
        "clicks": 131,
        "inline_link_clicks": 113,
        "ctr": 1.46,
        "cpm": 6.52,
        "cpc": 0.45,
        "frequency": 1.78,
        "reach": 5027,
        "purchases": 3,
        "roas": {
          "valor": 1.8,
          "selo": "Estimado"
        },
        "selo": "Real",
        "fonte": "dados de exemplo (fixture) — Academia Fit, fictício"
      },
      {
        "periodo": "2026-06-27",
        "granularidade": "dia",
        "spend": 59.65,
        "impressions": 9364,
        "clicks": 129,
        "inline_link_clicks": 111,
        "ctr": 1.38,
        "cpm": 6.37,
        "cpc": 0.46,
        "frequency": 1.84,
        "reach": 5089,
        "purchases": 3,
        "roas": {
          "valor": 1.68,
          "selo": "Estimado"
        },
        "selo": "Real",
        "fonte": "dados de exemplo (fixture) — Academia Fit, fictício"
      },
      {
        "periodo": "2026-06-28",
        "granularidade": "dia",
        "spend": 60.86,
        "impressions": 10010,
        "clicks": 125,
        "inline_link_clicks": 108,
        "ctr": 1.25,
        "cpm": 6.08,
        "cpc": 0.49,
        "frequency": 1.9,
        "reach": 5268,
        "purchases": 3,
        "roas": {
          "valor": 1.49,
          "selo": "Estimado"
        },
        "selo": "Real",
        "fonte": "dados de exemplo (fixture) — Academia Fit, fictício"
      },
      {
        "periodo": "2026-06-29",
        "granularidade": "dia",
        "spend": 62.19,
        "impressions": 10382,
        "clicks": 128,
        "inline_link_clicks": 110,
        "ctr": 1.23,
        "cpm": 5.99,
        "cpc": 0.49,
        "frequency": 1.96,
        "reach": 5297,
        "purchases": 3,
        "roas": {
          "valor": 1.4,
          "selo": "Estimado"
        },
        "selo": "Real",
        "fonte": "dados de exemplo (fixture) — Academia Fit, fictício"
      },
      {
        "periodo": "2026-06-30",
        "granularidade": "dia",
        "spend": 63.86,
        "impressions": 10185,
        "clicks": 125,
        "inline_link_clicks": 108,
        "ctr": 1.23,
        "cpm": 6.27,
        "cpc": 0.51,
        "frequency": 2.02,
        "reach": 5042,
        "purchases": 3,
        "roas": {
          "valor": 1.49,
          "selo": "Estimado"
        },
        "selo": "Real",
        "fonte": "dados de exemplo (fixture) — Academia Fit, fictício"
      },
      {
        "periodo": "2026-07-01",
        "granularidade": "dia",
        "spend": 66.03,
        "impressions": 9797,
        "clicks": 109,
        "inline_link_clicks": 94,
        "ctr": 1.11,
        "cpm": 6.74,
        "cpc": 0.61,
        "frequency": 2.08,
        "reach": 4710,
        "purchases": 2,
        "roas": {
          "valor": 1.68,
          "selo": "Estimado"
        },
        "selo": "Real",
        "fonte": "dados de exemplo (fixture) — Academia Fit, fictício"
      },
      {
        "periodo": "2026-07-02",
        "granularidade": "dia",
        "spend": 68.81,
        "impressions": 9746,
        "clicks": 98,
        "inline_link_clicks": 84,
        "ctr": 1.01,
        "cpm": 7.06,
        "cpc": 0.7,
        "frequency": 2.14,
        "reach": 4554,
        "purchases": 2,
        "roas": {
          "valor": 1.8,
          "selo": "Estimado"
        },
        "selo": "Real",
        "fonte": "dados de exemplo (fixture) — Academia Fit, fictício"
      },
      {
        "periodo": "2026-07-03",
        "granularidade": "dia",
        "spend": 72.25,
        "impressions": 10307,
        "clicks": 105,
        "inline_link_clicks": 90,
        "ctr": 1.02,
        "cpm": 7.01,
        "cpc": 0.69,
        "frequency": 2.2,
        "reach": 4685,
        "purchases": 2,
        "roas": {
          "valor": 1.73,
          "selo": "Estimado"
        },
        "selo": "Real",
        "fonte": "dados de exemplo (fixture) — Academia Fit, fictício"
      },
      {
        "periodo": "2026-07-04",
        "granularidade": "dia",
        "spend": 76.32,
        "impressions": 11357,
        "clicks": 111,
        "inline_link_clicks": 95,
        "ctr": 0.98,
        "cpm": 6.72,
        "cpc": 0.69,
        "frequency": 2.26,
        "reach": 5025,
        "purchases": 2,
        "roas": {
          "valor": 1.54,
          "selo": "Estimado"
        },
        "selo": "Real",
        "fonte": "dados de exemplo (fixture) — Academia Fit, fictício"
      },
      {
        "periodo": "2026-07-05",
        "granularidade": "dia",
        "spend": 80.93,
        "impressions": 12356,
        "clicks": 112,
        "inline_link_clicks": 96,
        "ctr": 0.91,
        "cpm": 6.55,
        "cpc": 0.72,
        "frequency": 2.32,
        "reach": 5326,
        "purchases": 2,
        "roas": {
          "valor": 1.41,
          "selo": "Estimado"
        },
        "selo": "Real",
        "fonte": "dados de exemplo (fixture) — Academia Fit, fictício"
      },
      {
        "periodo": "2026-07-06",
        "granularidade": "dia",
        "spend": 85.92,
        "impressions": 12786,
        "clicks": 115,
        "inline_link_clicks": 99,
        "ctr": 0.9,
        "cpm": 6.72,
        "cpc": 0.75,
        "frequency": 2.38,
        "reach": 5372,
        "purchases": 3,
        "roas": {
          "valor": 1.45,
          "selo": "Estimado"
        },
        "selo": "Real",
        "fonte": "dados de exemplo (fixture) — Academia Fit, fictício"
      },
      {
        "periodo": "2026-07-07",
        "granularidade": "dia",
        "spend": 91.1,
        "impressions": 12706,
        "clicks": 125,